{
  "schemaVersion": 1,
  "id": "http-and-javalin",
  "title": "HTTP and Javalin",
  "description": "Serving data over HTTP: how a request travels from browser to server, HTTP methods, status codes and JSON, routes and handlers in Javalin, and lambdas as handlers, then the F16 Project 1 brief: an in-memory repository behind an interface wired end to end through routes and a service, with error responses.",
  "topicOrder": [
    "how-a-request-travels",
    "http-methods-status-codes-and-json",
    "routes-and-handlers-in-javalin",
    "lambdas-as-handlers",
    "repository-wiring-and-errors-project"
  ],
  "moduleLabs": [],
  "assessments": [],
  "sourceCoverageNotes": [
    "Course slice: Foundation days F4-F18 (workflow/curriculum/snapshot/pep-curriculum.json /tracks/0/weeks/0/days/3 to /tracks/0/weeks/3/days/2). This module covers F15, F16 (/tracks/0/weeks/2/days/4, /tracks/0/weeks/3/days/0).",
    "Module grouping is a second-mate grouping decision recorded at intake (matrix record source-gap-java-foundations-modules), not syllabus: modules follow calendar day order and hold 4-9 topics.",
    "Every calendar row of these days maps to exactly one topic or project brief with relation exact; there are no splits or shared rows.",
    "F16 is a Project day: its three rows map to one canonical, reusable learner-facing project brief, repository-wiring-and-errors-project (kind lab-brief, because the topic schema has no project kind), whose topic coding lab holds one starter scaffold and one public test suite, test command mvn -q -o test. It is not a syllabus topic; topicOrder places it in calendar order. Standard and Fast overlays reference this same artifact (captain decision pep-project-rows, option A; intake-2 reconciliation education-recheck-01 and -02)."
  ]
}
