{
  "schemaVersion": 1,
  "id": "relational-design",
  "title": "Relational Design",
  "description": "Setting up PostgreSQL and a SQL client, then designing a relational schema: tables, primary and foreign keys, one-to-many and many-to-many relationships, turning a user story into tables, normalization basics, and writing CREATE TABLE with data types and constraints.",
  "topicOrder": [
    "installing-postgres-and-a-sql-client",
    "tables-keys-and-relationships",
    "designing-tables-from-a-user-story",
    "normalization-basics",
    "create-table-data-types-and-constraints"
  ],
  "moduleLabs": [
    "coding-lab"
  ],
  "assessments": [],
  "sourceCoverageNotes": [
    "Second-mate grouping decision, not syllabus: the calendar gives sql-jdbc-foundations no module grouping (matrix-v3 discrepancy source-gap-sql-jdbc-foundations-modules). This module is calendar day F19 (workflow/curriculum/snapshot/pep-curriculum.json /tracks/0/weeks/3/days/3), rows 0-4, one page per row (relation exact).",
    "Module coding lab relational-design/coding-lab (lab plan in workflow/evidence/sql-jdbc-foundations/intake.md): the learner writes schema.sql for a course enrollment user story; public JUnit tests load it through pgJDBC into the lab-created database relational_design_lab on the learner-local PostgreSQL server (no container), check tables, types and keys, and that constraint-violating inserts and deletes are rejected; test command mvn -q -o test. It covers tables-keys-and-relationships, designing-tables-from-a-user-story and create-table-data-types-and-constraints and is listed in moduleLabs."
  ]
}
