{
  "schemaVersion": 1,
  "id": "fetch-and-browser-client",
  "title": "Fetch and the Browser Client",
  "description": "Connecting a browser client to an API: fetching data, handling HTTP errors and ProblemDetail responses, fixing CORS, where tokens should live, calling a Spring Boot API, environment settings for the API address, and testing a plain function with Vitest.",
  "topicOrder": [
    "fetching-data",
    "handling-http-errors-and-problemdetail-responses",
    "fixing-cors-spring-security-config-vs-vite-dev-proxy",
    "cookies-vs-localstorage-where-tokens-should-live",
    "calling-your-spring-boot-api-from-the-browser",
    "environment-settings-for-the-api-address",
    "testing-a-plain-function-with-vitest"
  ],
  "moduleLabs": [],
  "assessments": [],
  "sourceCoverageNotes": [
    "Module grouping is a second-mate grouping decision made at intake, not syllabus: Standard days S26 and S27 in calendar order. Source slice: S26 rows 0, 1, 2, 3; S27 rows 0, 1, 2; Fast Track FT15 rows 0, 1, 2, 3, 4, 5, 6.",
    "Every Standard row and every Fast Track row in this slice maps to exactly one topic here with relation exact; Fast Track rows marked (skim) and the Reading: prefix are wording variants of the same canonical topic.",
    "Planned module coding lab html-css-js/fetch-and-browser-client/coding-lab for the Standard S26 overlay (see workflow/evidence/html-css-js/intake.md, section Lab plan); it is authored in the fetch-and-browser-client module PR and listed in moduleLabs only once it exists. Fast Track skips coding labs.",
    "S27 is a Project day: its three rows are project-row inputs on the Standard track, while FT15 lists the same strings as instructional topics, so each gets one canonical topic page shared by both tracks; no new syllabus is added.",
    "Captain decision pep-project-rows option A: the S27 Project row gets one reusable learner-facing project brief, the course-level project html-css-js/coding-lab (outcomes, prerequisite alignment, starter scaffold, public Vitest tests; no containers, no committed solutions or hidden tests), reused unchanged by the Standard S27 and Fast Track FT15 overlays and authored in a course-level PR (see workflow/evidence/html-css-js/intake.md, section Project brief (S27)).",
    "Captain decision pep-fast-project-block option A: Fast project increment 4 (FT15, the S27 brief) applies this module's topics except cookies-vs-localstorage-where-tokens-should-live, inside each Fast day's 70-minute Project block with embedded teach-then-check steps, as part of the one cumulative course project html-css-js/coding-lab presented to Fast learners as project increments, never as a coding lab (see workflow/evidence/html-css-js/intake.md, section Fast project increments (FT12-FT15))."
  ]
}
